时间,姓名,内容,阅读,评论,,,,,
2021/3/15 10:12,石瓢紫砂壶,找底！耐心瑾慎,139,0,,,,,
2021/3/15 9:59,神龙摆尾99999,其实发行价26，发行盘5000万，开盘60炒到200，一样圈,290,0,,,,,
2021/3/15 9:43,股友GO9aV5,就那产品质量，一年质保，不跌才怪,161,0,,,,,
2021/3/15 9:37,股友c62T3O,很快到400以下,167,0,,,,,
2021/3/15 9:35,股友TcCKR3,垃圾。砸中,193,0,,,,,
2021/3/15 9:00,清醒看时局,极米科技：此股含金量超[爱美客] 先看800元！,1186,10,,,,,
2021/3/15 8:23,农民工打工,你敢说极米在酒店应用不广吗极米不能用来智能办公吗极,334,0,,,,,
2021/3/14 23:10,曹莫莫,你个孤儿,169,0,,,,,
2021/3/14 22:31,涨跌看仓位,盘子太大了，明天一低开又是多杀多，阴跌开始。,193,0,,,,,
2021/3/14 16:24,股友Xn8kiM,国内旅游市场将回到增长轨道2021-03-12来源：北京日报,536,0,,,,,
2021/3/14 12:23,Double升升,先到180附近,327,0,,,,,
2021/3/14 11:47,股友heyaHv,为啥股吧杂鱼全是唱空的？出奇一致,516,6,,,,,
2021/3/14 10:41,力道1299804,极米产品玩家是8090后，年轻人的爆款产品，也是年轻人,1001,5,,,,,
2021/3/14 10:36,定定的狐,下午翻红,350,2,,,,,
2021/3/14 7:21,两袖青龙,唱空占据了大面积篇幅好股,309,1,,,,,
2021/3/14 7:07,hzj99188,一群傻缺，难怪中签的人赚20多万一个，有这么多傻缺在,335,0,,,,,
2021/3/13 23:13,莫高XO马扎罗VSOP,大家好，价值投资再出发，今天上榜一个真正的价值低股,564,2,,,,,
2021/3/13 21:40,走过好望角,关于极米，谈谈我的看法极米我第一天开盘全出了，距离,2191,30,,,,,
2021/3/13 17:49,股友610d3z1176,高于100，或许都是炮灰,179,1,,,,,
2021/3/13 16:11,amway555888,极米科技发行费用1.1亿计入一季度的成本吗？,285,0,,,,,
2021/3/13 15:44,股权之争_勇者胜,给予1倍于发行价的溢价，266元收一部分,255,1,,,,,
2021/3/13 14:41,走过好望角,你以为我在唱空？那你去看看我早上发的数据说话那个帖,287,0,,,,,
2021/3/13 14:00,强威天下,终于知道咋回事了，极米315暴雷了,436,2,,,,,
2021/3/13 13:29,极米科技资讯,德邦证券维持极米科技增持评级 极米科技深度之公司详,2112,12,,,,,
2021/3/13 11:33,走过好望角,汇顶科技的现在就是极米科技的将来。有种的别跑，拿住,688,2,,,,,
2021/3/13 10:32,lvyw,两融余额持续缩减 科创板次新股获资金关注,2253,1,,,,,
2021/3/13 9:58,牛股数据宝,腰斩到300以下，应该没有悬念！这样说，可能持股的人,617,1,,,,,
2021/3/13 9:54,若愚之石,各位小散好好看看，本人高位提示狗庄诱多出货，之后便,279,1,,,,,
2021/3/13 7:53,极米科技资讯,极米科技(688696)融资融券信息(03-12),547,0,,,,,
2021/3/12 23:35,笋子的精神,周线墓牌线！也就是死人线！恐怖之极！有票的朋友自己,341,2,,,,,
2021/3/12 23:08,股友d3523927d6,有散户中签的吗？,311,2,,,,,
2021/3/12 18:55,极米科技股友,董秘您好，极米科技，2020国内投影仪出货量、销售额双,1381,2,,,,,
2021/3/12 17:50,赚或是不赚,喋喋不休,571,8,,,,,
2021/3/12 16:23,天南海北1,现在是主力也不敢往下打洗盘，一下去就会被融券的人买,293,0,,,,,
2021/3/12 16:21,股友WPKeBi,狗庄天天高抛低吸,238,2,,,,,
2021/3/12 16:19,天钰喆,有什么慌得，看看石头科技也不是一两天就涨上来的，拿,350,2,,,,,
2021/3/12 16:13,极米科技股友,请问贵公司，百度作为公司的股东，公司可不可以向百度,552,1,,,,,
2021/3/12 15:43,股友r9zBEO,不要慌做做差价,241,1,,,,,
2021/3/12 15:29,农民工打工,又是无聊的一天517卖485买,322,2,,,,,
2021/3/12 15:10,股友TcCKR3,给中望提鞋都不配垃圾主力,227,1,,,,,
2021/3/12 14:55,股友TcCKR3,你这个砸中,178,0,,,,,
2021/3/12 14:54,fJJf,极米无屏电视和市场占有率高是看点，如果普及电视机都,1271,5,,,,,
2021/3/12 14:53,神龙摆尾99999,现在的走势就像一个风雨飘摇中风烛残年的老人，下周向,202,0,,,,,
2021/3/12 14:46,ckw528,当初恒玄科技也是机构极力推荐，天天发研报推荐，看看,398,1,,,,,
2021/3/12 14:42,宗国银河,看样子今天还得收阳线天天洗呀洗,179,0,,,,,
2021/3/12 14:37,股友TcCKR3,狗庄是砸中,129,1,,,,,
2021/3/12 14:36,石瓢紫砂壶,破位下行！危险地,162,0,,,,,
2021/3/12 14:35,走过好望角,如果跌了，说明庄家已经完成任务，如果涨了,302,2,,,,,
2021/3/12 14:25,域林7777,我是被研报骗进来的你呢？,172,0,,,,,
2021/3/12 14:17,一生何求2040,再加仓,165,0,,,,,
2021/3/12 14:15,股友S7jpyh,下周穿破470,133,0,,,,,
2021/3/12 14:13,股友GO9aV5,有股友用极米的投影仪吗？一年质保，过保就,484,7,,,,,
2021/3/12 13:59,宗国银河,买了一台,1021,8,,,,,
2021/3/12 13:52,巴菲特BMW,今天肯定收红,236,2,,,,,
2021/3/12 13:49,极米科技资讯,极米科技深度之公司详解：极米的壁垒有多高,9637,24,,,,,
2021/3/12 13:45,巨贪饕餮,513走人。。五个点,177,0,,,,,
2021/3/12 13:23,若愚之石,典型的拉高诱多，狗庄连续多日诱多出货，小,216,0,,,,,
满天彩,筹码集中。,昨日主力洗筹成功,218,1,2021/3/12 13:05,,,,
2021/3/12 11:48,熊市谨慎生存,机构进场了，要大涨了，守住[大笑][大笑][,234,0,,,,,
2021/3/12 11:07,一切一切都是虚无,一样的的味道，一样的套路，这种没什么科技,977,10,,,,,
2021/3/12 10:57,海龟飞过3927,还是金山牛啊,167,0,,,,,
2021/3/12 10:00,石瓢紫砂壶,出小研必跌！股市小定律，危险地,162,0,,,,,
2021/3/12 9:35,泰山狼行天下,果然妍报都是坑人的,206,0,,,,,
2021/3/12 9:29,股市不赔钱跑得快,好机会啊兄弟们买,155,0,,,,,
2021/3/12 9:23,石瓢紫砂壶,暴跌,140,0,,,,,
2021/3/12 9:03,记住股市不是慈善,这股严重高估，不知道发行价怎么来的？,189,0,,,,,
2021/3/12 8:57,无忧花开2234759,今天很明显在洗盘,551,5,,,,,
2021/3/12 7:43,极米科技资讯,极米科技(688696)融资融券信息(03-11),508,0,,,,,
2021/3/11 23:51,看着你999,屁个涨停，融券这么多能吗,166,0,,,,,
2021/3/11 23:35,平常心8844150453,百度要在香港上市 这股可会跟上涨一波,303,2,,,,,
2021/3/11 22:21,神龙摆尾99999,500多元，是否极度低估?还是已经透支了未来几年?这是,313,0,,,,,
2021/3/11 22:12,柯大侠1937,完了研报又来了德邦证券也来忽悠明天又得大跌了[呲牙],359,1,,,,,
2021/3/11 20:48,股友S7jpyh,散户跟进太多，大资金会让大家轻松赚钱？,284,0,,,,,
2021/3/11 20:32,飞驰的小阳阳,事出反差必有妖明天见,234,0,,,,,
2021/3/11 20:02,guoweili,477割肉最低点了,358,3,,,,,
2021/3/11 19:39,需要运气,看了这些个研报，买了5手的我瑟瑟发抖！,368,0,,,,,
2021/3/11 19:16,柯大侠1937,要不是大盘大涨这货起码跌10个点,338,2,,,,,
2021/3/11 18:16,Irene321,底部割肉8千多股，哭晕，还是不能盯盘，扛不住的慌，,781,9,,,,,
2021/3/11 17:26,神龙摆尾99999,名不见经传的坚果、当贝就可以大幅增长，虎视眈眈的小,462,0,,,,,
2021/3/11 15:54,云588,看好极米,260,0,,,,,
2021/3/11 14:56,wxyzzrzxg,今天开始连续阴跌！,173,0,,,,,
2021/3/11 14:43,历史砖家,老师说极米科技今天开始15个地停板,483,5,,,,,
2021/3/11 14:42,股市风险提醒,极米的主力不强，今天炒作明显看出来了！,329,2,,,,,
2021/3/11 14:38,拾贝88888888,卖了卖了，全卖了，经不起折腾了！,180,0,,,,,
2021/3/11 14:24,石瓢紫砂壶,今日必创新低！瑾慎耐心,180,0,,,,,
2021/3/11 14:23,guoweili,每天收盘的时候砸,176,0,,,,,
2021/3/11 14:16,美丽的海岛,地极米让我亏1.3万跑出来，跟鬼机构玩不行,395,5,,,,,
2021/3/11 14:13,域林7777,尾盘创新低吗？,226,1,,,,,
2021/3/11 14:09,柯大侠1937,下午收盘价估计在460-472之间,218,1,,,,,
2021/3/11 14:01,福建总舵主,这一波下跌，好多人割肉出局了,369,5,,,,,
2021/3/11 13:57,智能大屏观察网,IDC2020年中国投影机市场报告：当贝投影连续两年增长,1349,4,,,,,
2021/3/11 13:41,一生何求2040,昨天出了酒鬼酒买了这货[哭][哭][哭],187,0,,,,,
2021/3/11 13:25,熊市谨慎生存,这诱多？,182,0,,,,,
2021/3/11 13:20,爱相随168,我一下车，你果然就涨上来了！不好意思，是我一直在压,193,0,,,,,
2021/3/11 13:03,你抛我接,继续补仓,155,0,,,,,
2021/3/11 12:51,梦魇股市,放量大跌？收盘520以上我就追高，否则只能做空…,167,0,,,,,
2021/3/11 12:36,股友tWp8bf,100都高,160,0,,,,,
2021/3/11 12:31,宗国银河,其实这样挺好磨磨底不需要快速拉升,217,0,,,,,
2021/3/11 11:55,自主研究自主投资,这货怎么样？,306,2,,,,,
2021/3/11 11:40,小散之无忧,我发起了一个投票，【#极米科技#今日周四收盘】，快来,222,0,,,,,
2021/3/11 11:29,农民工打工,大家一起把他买到1000,171,0,,,,,
2021/3/11 11:23,福建总舵主,主力割肉跑了,173,0,,,,,
2021/3/11 11:22,神龙摆尾99999,这么高的发行价，可见实控人对公司并无信心，圈钱到手,303,0,,,,,
2021/3/11 11:20,米乐2012,主要还是没有核心竞争力组装为主，市场份额和软件优势,181,0,,,,,
2021/3/11 11:17,scxcxy,主力是笨蛋，大好行情给浪费了,182,0,,,,,
2021/3/11 11:16,股权之争_勇者胜,坐等400,143,0,,,,,
2021/3/11 11:12,股友S7jpyh,害人模式，60分钟线完蛋了！,132,0,,,,,
2021/3/11 11:10,极米科技资讯,极米科技(688696)融资融券信息(03-09),623,1,,,,,
2021/3/11 11:02,穿山甲666,散户太多了有的震荡了,214,3,,,,,
2021/3/11 10:57,股友TcCKR3,你怎么就这么见这么垃圾呢,158,0,,,,,
2021/3/11 10:53,股友TcCKR3,你们这些空狗都是砸中,151,0,,,,,
2021/3/11 10:50,暖阳花香微风,别再说第二个爱美客了，看看爱美客今天涨了多少，再看,194,0,,,,,
2021/3/11 10:48,木头宁1,收盘如果大阴线，明天低开，会亏多少？有没有想过？,169,0,,,,,
2021/3/11 10:46,股友Eqybeb,3.15后再决定是否加仓,151,0,,,,,
2021/3/11 10:41,皮股民一个,涨停我爱你,170,1,,,,,
2021/3/11 10:24,自主研究自主投资,这货怎么样？,156,0,,,,,
2021/3/11 10:23,谁不爱强势股,跟中望那个垃圾走呀？人家二百倍的市盈率，业绩不到你,154,0,,,,,
2021/3/11 10:20,无忧花开2234759,明显洗盘，今天还有高点出现,160,0,,,,,
2021/3/11 10:20,定定的狐,500大元再次买入200股，肉来,142,0,,,,,
2021/3/11 10:06,熊市谨慎生存,跌20个点,108,0,,,,,
2021/3/11 10:02,股友TcCKR3,真是砸中,128,0,,,,,
2021/3/11 9:37,股友r9zBEO,炮位已架好,149,0,,,,,
2021/3/11 9:12,农民工打工,其实你们不懂极米科技投资股东有百度和芒果说明他们对,395,0,,,,,
2021/3/11 8:32,皮股民一个,老师说每天最少涨9个点,199,0,,,,,
2021/3/11 8:07,百元奥飞,10倍市净率，100倍市盈率，唉，投影机科技含量低，市,271,1,,,,,
2021/3/11 8:00,皮股民一个,我觉得今天应该涨9个点吧,211,0,,,,,
2021/3/11 7:41,极米科技资讯,极米科技(688696)融资融券信息(03-10),543,0,,,,,
2021/3/11 1:16,江河汇,驿站像游戏一下刺激上瘾,174,0,,,,,
2021/3/11 0:47,透过现象,大盘风险，高价股开始大跌！,234,6,,,,,
2021/3/10 23:10,fJJf,爱美客二千六百万盘，净资34元，业绩3.66元，十送八开,343,0,,,,,
2021/3/10 22:58,股神来看望你们,极米科技开盘最低500元，正常会开在550以上，第一天炒,2164,13,,,,,
2021/3/10 22:11,wxyzzrzxg,今天冲进去抄底的几乎全军覆没！明天开始慢慢下跌！,412,2,,,,,
2021/3/10 21:41,美丽的海岛,大家不要买极米，极米百分之百机构在里面,324,0,,,,,
2021/3/10 21:34,走过好望角,明天开盘挂涨停价买入，听股友的建议，打算拿到1600，,494,7,,,,,
2021/3/10 20:32,觅牛者001,都不要神预测了，五百附近震荡一段时间选择方向。最低,427,0,,,,,
2021/3/10 19:16,股友nu9KS6,市场占有率第一[憨笑][憨笑][憨笑],428,1,,,,,
2021/3/10 18:28,谁不爱强势股,爱美客第二，上市331一直走到1331，涨了1000远！,671,3,,,,,
2021/3/10 18:11,金股银股6666,它的表现挺好的，昨天的跌幅，今天完全收复了，目前看,297,0,,,,,
2021/3/10 17:53,非专业de股民,哈哈：我也斗胆买了500股啊,233,0,,,,,
2021/3/10 17:07,股友56291e669E,早说过最近新股也有极米开盘买进不套人,283,0,,,,,
2021/3/10 16:39,农民工打工,明天看下能不能上5日线,198,0,,,,,
2021/3/10 20:33,中访网财经,极米科技有点“软”,3545,1,,,,,
2021/3/10 15:43,大连杨亿,极米科技300亿市值高潮未平，“后浪”峰米科技未来估,816,1,,,,,
2021/3/10 15:05,丫丫港股圈,值得放在观察名单的投影赛道龙头股：极米科技,3282,0,,,,,
2021/3/10 14:47,指数增强小,新股1个板都没封住，牛年以来首例！,2475,0,,,,,
2021/3/10 14:27,股友kTHmhD,赶快涨停，明天再跌停,216,1,,,,,
2021/3/10 14:21,一生何求2040,马上就第一名,407,0,,,,,
2021/3/10 14:04,春天1978,没人接盘，把股东愁死了！哈哈哈！,214,0,,,,,
2021/3/10 13:06,极米科技资讯,智能投影风起，国货正当时,11480,20,,,,,
2021/3/10 12:38,石瓢紫砂壶,破五日线！逃之,267,2,,,,,
2021/3/10 11:50,一生何求2040,火速加仓，60个交易日会涨到850元[呲牙][呲,265,0,,,,,
2021/3/10 11:14,eightszk,我的乖乖，真想买呀！,273,0,,,,,
2021/3/10 11:07,股友r9zBEO,我可以明确地告诉你们523.87元不是今日的最,333,1,,,,,
2021/3/10 11:06,啥最无聊,昨天尾盘割肉的劝你销户吧。哈哈哈哈。大sx,457,3,,,,,
2021/3/10 11:03,追星族st,昨天喊你们抄底了，今天爽歪歪呀！涨停我就,198,0,,,,,
2021/3/10 11:02,工科迷途小书童76,可以跑了，形势不对,208,1,,,,,
2021/3/10 10:48,神龙摆尾99999,长熊走势,147,0,,,,,
2021/3/10 10:30,泰山狼行天下,又要诱多发套吗，散户跟少，狗咬狗,147,0,,,,,
2021/3/10 9:59,Bufferos,有人给拉起来刘要赶快卖,152,0,,,,,
2021/3/10 9:53,啥最无聊,跟爱美客七个亿营收800亿市值比，你真应该,514,3,,,,,
2021/3/10 9:35,皮股民一个,今天能上600吗？,229,1,,,,,
2021/3/10 8:54,历史砖家,极米科技今天开始暴跌至少15个跌停,439,3,,,,,
2021/3/10 8:45,看见风电扇,好公司呀,391,2,,,,,
2021/3/10 8:20,非专业de股民,融券多多啊,371,1,,,,,
2021/3/10 8:18,股圣之股侠,预计高开6%左右，美股科技股暴涨,221,0,,,,,
2021/3/10 7:52,锦缎研究院,极米科技有点“软”,2889,0,,,,,
2021/3/10 7:16,你姐夫快回来了,明天会涨一倍,847,14,,,,,
2021/3/10 3:56,天山水哥,国内投影设备行业龙头企业,425,0,,,,,
2021/3/9 23:44,股尊Lisir,15年炒股经验告诉我学会止损比赚钱更重要,625,11,,,,,
2021/3/9 23:41,啥最无聊,A50开始拉升。尾盘恐慌盘卖出明显。错杀,487,5,,,,,
2021/3/9 23:37,柯大侠1937,622下来跌了近140快28个点高价股跌起来是要,190,0,,,,,
2021/3/9 23:21,股友jlq8N2,步夏新电子后尘,144,0,,,,,
2021/3/9 22:33,大象小鱼,好公司啊,1122,3,,,,,
2021/3/9 22:23,股友S7jpyh,主力资金已清仓甩卖了吗？看不出来,230,1,,,,,
2021/3/9 21:49,小熊小熊杰里米,不错的公司,206,0,,,,,
2021/3/9 20:05,股友S7jpyh,上窜下跳的逐波杀跌走低！唉，套住了咋办的,164,0,,,,,
2021/3/9 20:02,啥最无聊,A50暴涨，尾盘恐慌割肉的sx,236,0,,,,,
2021/3/9 19:51,骑毛毛打泡泡,科创板可能要将50万的门槛下调了，估计要跟,1438,2,,,,,
2021/3/9 19:29,笋子的精神,下跌中继！,206,0,,,,,
2021/3/9 19:25,不信邪不认命,明天440,163,0,,,,,
2021/3/9 19:16,域林7777,继续买入下不来的样子,489,5,,,,,
2021/3/9 19:25,不信邪不认命,明天440,163,0,,,,,
2021/3/9 19:16,域林7777,继续买入下不来的样子,489,5,,,,,
2021/3/9 19:09,佐罗大黑马,$极米科技(SH688696)$688696极米科技，减仓。,272,0,,,,,
2021/3/9 18:11,中签挣钱,祝中签的都发大财！,210,1,,,,,
2021/3/9 17:49,啥最无聊,纳指期货超跌暴涨反弹。明天科技股领涨？,188,0,,,,,
2021/3/9 17:12,一个低调小散,都说了，没有任何技术含量的玩意，不跌成才怪,166,0,,,,,
2021/3/9 17:06,梦想之神1,100元见[微笑],195,0,,,,,
2021/3/9 16:58,粗壮大树,市场占有率高,652,3,,,,,
2021/3/9 16:52,股圣之股侠,【证监会“云反馈”上海人大代表建议：将认真研究科创,533,0,,,,,
2021/3/9 16:49,小道萧克明,这么多唱多的～,153,0,,,,,
2021/3/9 16:43,又红又专小韭菜,韭菜们都在喊好！这股近期没希望了！只能坐地吃瓜了！,183,0,,,,,
2021/3/9 16:36,海洋一虚竹,胡说八道,193,0,,,,,
2021/3/9 16:30,珍惜强庄炒作,不要问我为什么？今天肯定拉起来！,615,7,,,,,
2021/3/9 15:55,吓不到的小散,今天早上确实是个机会。不过，价格太贵，只能少干一点,389,5,,,,,
2021/3/9 15:48,佐罗大黑马,$688696极米科技$，周一的阴线以最低价收盘，这样明天,1366,2,,,,,
2021/3/9 15:38,实时更新,只要融劵的不砸盘，风险就不大,255,1,,,,,
2021/3/9 15:35,kektttttttt,这个股是龙头,240,0,,,,,
2021/3/9 15:32,一生何求2040,可以抄底了[呲牙][呲牙][呲牙][呲牙],295,3,,,,,
2021/3/9 15:18,海洋一虚竹,它不跌100元！我姓王,276,2,,,,,
2021/3/9 15:13,wxyzzrzxg,今天冲进去抄底的几乎全军覆没！明天开始慢慢下跌！,168,0,,,,,
2021/3/9 15:02,wsxu9892,垃圾股，,194,0,,,,,
2021/3/9 14:49,MR硕,个人感觉今天吉米低吸好机会！指数进入技术熊市！寻找,597,4,,,,,
2021/3/9 14:19,豫则立不豫则亏,曾经投影仪祖宗暴风科技走到悬崖边跳了下去,392,4,,,,,
2021/3/9 13:46,梦魇股市,这么多融券，乖乖,204,0,,,,,
2021/3/9 13:26,海洋一虚竹,最难系的股票！我用10个亿能量吗？,191,0,,,,,
2021/3/9 13:21,期市低拥,都觉得极米凉了，但是告诉你们600远不是顶，一月内见8,475,2,,,,,
2021/3/9 13:12,马踏飞燕15,在中国有几家公司收取全球行业专利费的？光峰科技收取,488,4,,,,,
2021/3/9 12:45,小钢炮99,大盘差不多要见底反弹了，这时候不炒作新股，难道去解,489,1,,,,,
2021/3/9 12:32,股友jlq8N2,最高622元回调50%311元必然能看到,198,0,,,,,
2021/3/9 12:20,老牛__耕田,《明日破500元就买您》,260,1,,,,,
2021/3/9 11:58,股市风险提醒,今天大阳包阴，打暴空头创新高！,498,8,,,,,
2021/3/9 11:43,你姐夫快回来了,马上让空头崩血,221,1,,,,,
2021/3/9 11:40,六边形散户,被洗了，亏三个点走的，还能进吗,293,2,,,,,
2021/3/9 11:39,hgffxx,自从买了极米智能投影，每天看8小时,909,3,,,,,
2021/3/9 11:37,皮股民一个,卡位买入！拉涨停加油,170,0,,,,,
2021/3/9 11:13,MR硕,买入机会出现！吉米今天会再次放光芒吗？看你们实力了,180,0,,,,,
2021/3/9 11:11,福建总舵主,疯狂卖股票的不去调研一下这家公司么？那么好的公司,257,1,,,,,
2021/3/9 11:06,临池学书得玉兰,珍惜肯定是股市中的第一傻。[大笑],208,1,,,,,
2021/3/9 11:05,枪X狗庄,要是美国上市，千亿起步啊[大笑],220,0,,,,,
2021/3/9 11:02,蓝谷月,垃圾A在这股搞一个世界级的历史记录看看你就牛逼了，,161,0,,,,,
2021/3/9 10:51,巨贪饕餮,虚怀所至，片甲不留！！[鼓掌][鼓掌][大笑][大笑],240,1,,,,,
2021/3/9 10:49,你姐夫快回来了,开始翻倍之，就在今天,193,2,,,,,
2021/3/9 10:49,南风无级8367,跑吧，大盘大跌。,152,1,,,,,
2021/3/9 10:46,龘龘化雨,今天给一个百分之三十的跌幅。,149,0,,,,,
2021/3/9 10:44,证券市场红周,极米科技300亿市值高潮未平，“后浪”峰米科技未来估,2020,1,,,,,
2021/3/9 10:39,wxyzzrzxg,今天是无涨跌幅限制的最后一天！表现平平！,150,0,,,,,
2021/3/9 10:33,股友1155r226U5,有吧友说今天涨一倍=1020元，有的难，50%有可能,290,1,,,,,
2021/3/9 10:31,股友TcCKR3,真是,145,0,,,,,
2021/3/9 10:29,股友1155r226U5,全球第一的消费电子股，只有255亿市值，骗谁的筹码？,625,7,,,,,
2021/3/9 10:24,珍惜强庄炒作,上午快速洗盘然后拉起来，下午继续大阳线；做市场总龙,899,9,,,,,
2021/3/9 10:07,皮股民一个,抄底发财,212,0,,,,,
2021/3/9 9:57,一生何求2040,牛牛,187,0,,,,,
2021/3/9 9:56,落袋帅师哥,涨起来！开始反弹起来了！,182,0,,,,,
2021/3/9 9:52,guoweili,今天最高价500最低价430,206,0,,,,,
2021/3/9 9:34,枪X狗庄,今天能不能涨50%？[为什么][为什么][为什么],208,0,,,,,
2021/3/9 9:32,股友ijmNpi,468满仓,218,0,,,,,
2021/3/9 9:31,股海无涯之常胜,开始套人了,207,0,,,,,
2021/3/9 9:28,做人要厚道别挨骂,这股票今年上半年看不到1000块。,204,0,,,,,
2021/3/9 9:17,极米科技资讯,2021年第一“大肉签”最高赚近24万！还有340%的上涨空,3998,7,,,,,
2021/3/9 9:03,做好每一笔投资,长线大牛股,606,2,,,,,
2021/3/9 8:58,极米科技资讯,极米科技(688696)融资融券信息(03-08),904,3,,,,,
2021/3/9 8:52,极米科技资讯,国盛证券给予极米科技增持评级 智能投影风起 国货正当,1954,13,,,,,
2021/3/9 8:41,股友5g277Z2909,极米没有技术含量，就是个纯销售公司，不要抱太大希望,182,0,,,,,
2021/3/9 8:28,牛诸仙,买。大买。,259,1,,,,,
2021/3/9 8:13,极米科技资讯,中一签可浮盈近24万元 百度加持的极米科技真的这么牛,4735,25,,,,,
2021/3/9 7:54,历史砖家,纳斯达克暴跌了，极米科技跟着暴跌是必然的，今天开始,269,0,,,,,
2021/3/9 7:45,不谷雨,好票,336,0,,,,,
2021/3/9 6:41,马踏飞燕15,说光峰科技是全球激光显示的核心资产一点也不过份，光,554,1,,,,,
2021/3/9 6:12,我叫东方核神,新股上市涨幅太多，慢慢回家了，（发行价）,151,0,,,,,
2021/3/9 2:56,白骨精打蟑螂,看好爆发,273,0,,,,,
2021/3/9 1:08,老范股民5199,烂股,140,0,,,,,
2021/3/9 0:21,福建总舵主,天猫这个月出货量是2.5w台，一年天猫出货30w。京东至,372,1,,,,,
2021/3/9 0:19,股友iqxbxd,明天估计跌停开盘,249,5,,,,,
2021/3/8 23:51,股友S7jpyh,废了,165,0,,,,,
2021/3/8 23:45,夏日丽丝,教学投影仪市场几千亿，钟波应该关注教学投影仪市场，,181,0,,,,,
2021/3/8 23:31,股友EN3x5G,还债了,187,0,,,,,
2021/3/8 23:06,情有独角兽,极米H3S即将上市，等着收米把，三月底800元上,243,0,,,,,
2021/3/8 22:56,针尖起舞,中国爱美客：明天涨停20cm,319,2,,,,,
2021/3/8 22:43,无锚铁甲舰,和石头有质的区别,293,1,,,,,
2021/3/8 22:15,智能大屏观察网,面板价格上涨带动彩电终端涨价，智能投影市场再添利好,871,5,,,,,
2021/3/8 22:43,无锚铁甲舰,和石头有质的区别,293,1,,,,,
2021/3/8 22:18,SUNLEE,产品不可复制的核心技术是什么？如果没有，那就是一台,345,2,,,,,
2021/3/8 22:15,股市新秀无崖子,不错，周一有肉吃了[鼓掌][鼓掌][鼓掌],1062,16,,,,,
2021/3/8 22:15,优质股圆狐底,4.5亿利润，50倍估值，还是比较安全的,310,2,,,,,
2021/3/8 21:13,股友OMVi5D,极米科技股价会超茅台，中芯国际市值会超茅台,242,1,,,,,
2021/3/8 20:59,悬壶济世66,支持！,158,0,,,,,
2021/3/8 20:39,玩个毛灬,牛逼上头了，还有大杀,165,0,,,,,
2021/3/8 20:09,柯大侠1937,几个研报都是让人接盘的大忽悠大家别上当啊卖了就不再,228,0,,,,,
2021/3/8 20:05,W梦想总是要有的,一直提醒5.6亿的融券不是来送钱的，明天杀到450，后天,484,1,,,,,
2021/3/8 19:49,股友6sy9Of,抄底的肯定都是贝勒爷,182,0,,,,,
2021/3/8 19:41,才望成金得安琪拉,今天股价正好跌一百块,241,1,,,,,
2021/3/8 19:35,股友1155r226U5,东兴证券公开评级极米长期股价1600元。,437,2,,,,,
2021/3/8 19:29,小笋尖,《600元追了600股》,586,7,,,,,
2021/3/8 19:22,股友1155r226U5,企业家精神 | 钟波：要将极米科技打造成中国的苹果,1298,10,,,,,
2021/3/8 19:19,悦古东,做空动力强，明天破486,385,3,,,,,
2021/3/8 19:14,股友S7jpyh,清仓式杀跌出货，完蛋,163,0,,,,,
2021/3/8 19:11,股友1155r226U5,极米A股目前唯一能上千元的股票。如不送配唯一能超过,163,0,,,,,
2021/3/8 18:47,专拣便宜的高档货,400以下再买，忍耐加等待,223,1,,,,,
2021/3/8 17:57,牧野之声,期待复制思瑞浦的走势,890,14,,,,,
2021/3/8 17:54,股友aTDLU5,腰斩以后再说,159,0,,,,,
2021/3/8 17:23,等待突破87,我是中签的528卖的，明天开始建仓，也算做了1万多差价,219,0,,,,,
2021/3/8 17:17,巴菲特BMW,明天低开500以下，我想把 上周卖出的接回来,164,0,,,,,
2021/3/8 17:16,从巴韭特到巴菲特,融券的牛逼了爆赚,160,0,,,,,
2021/3/8 17:11,针尖起舞,极米科技：产品体验极差。大家百度下＂极米科技评价＂,309,1,,,,,
2021/3/8 17:07,走过好望角,喊上1500的呢？出来走两步？,188,0,,,,,
2021/3/8 17:00,SDinvestment,先把话放这，对付极米，根本用不了光峰亲自出马，光峰,480,3,,,,,
2021/3/8 16:55,咔咔咔咔就是赚,这种垃圾股就是下一个派能科技,290,1,,,,,
2021/3/8 16:25,小鱼黄,虽然第一天511出局，仍希望它逐级盘上,204,0,,,,,
2021/3/8 16:22,股友JlbtXT,明天看谁跑得快啦！手慢套住，哈哈。跌个百分之四十,183,0,,,,,
2021/3/8 16:19,笋子的精神,墓碑线！要死人的！明天继续暴跌，500元上是世纪顶！,248,0,,,,,
2021/3/8 16:16,永高600519,跌到300以下都有可能。高价股跌起来怕人,158,0,,,,,
2021/3/8 16:16,马踏飞燕15,要买就买激光显示龙头688007光峰科技。688007现价27.5,758,4,,,,,
2021/3/8 16:02,股友1155r226U5,明天涨个30点给你看看，哈哈哈！,282,1,,,,,
